{
  "schemaVersion": 2,
  "project": {
    "id": "dev.luastra.constellation-orbit",
    "entry": "app/main"
  },
  "sdk": {
    "contract": 1
  },
  "capabilities": ["app.launchurl.get", "navigation.history", "storage.get", "storage.set", "timer.control", "ui.render"],
  "modules": [
    {
      "id": "app/main",
      "source": "src/main.luau",
      "dependencies": ["luastra/host", "luastra/navigation", "luastra/timer", "luastra/ui"]
    },
    {
      "id": "app/tests/orbit",
      "source": "src/test.luau",
      "dependencies": ["app/main"]
    }
  ],
  "tests": ["app/tests/orbit"]
}
