{
  "schemaVersion": 2,
  "project": {
    "id": "dev.luastra.accessibility-lab",
    "entry": "app/main"
  },
  "sdk": {
    "contract": 1
  },
  "capabilities": ["ui.render"],
  "modules": [
    {
      "id": "app/main",
      "source": "src/main.luau",
      "dependencies": ["luastra/app", "luastra/ui"]
    }
  ],
  "tests": []
}
